source_db,source_table,source_file,source_row_id,sequence,length,sequence_valid,canonical_aa_only,ic50_uM,ic50_uM_min,ic50_uM_max,ic50_uM_median,ic50_relation_raw,ic50_status_raw,label_type,label_is_exact,is_sequence_level,source_count,record_count,high_confidence_flag,conflict_flag,tier_23,raw_record_ids,citation_ids,notes,exclusion_reason,filtered_source_name
,,,150,AYFYPE,6,True,True,260.82,260.82,260.82,260.82,=,exact_molar,sequence_level_core,True,True,1,1,,,,mbpdb_ace_000297 || MBPDB_P02662_AYFYPE_158-163,"1) 10.1016/j.idairyj.2013.05.008, 2) 10.3168/jds.S0022-0302(94)77026-0, 3) 10.3390/foods9080991","1) Resistance of casein-derived bioactive peptides to simulated gastrointestinal digestion, 2) Antihypertensive Effect of the Peptides Derived from Casein by an Extracellular Proteinase from Lactobacillus helveticus CP790, 3) In Silico and In Vitro Analysis of Multifunctionality of Animal Food-Derived Peptides || Bos taurus || Alpha-S1-casein",out_of_length_range,mbpdb_core_standardized
,,,151,CMENSA,6,True,True,788.0,788.0,788.0,788.0,=,exact_molar,sequence_level_core,True,True,1,1,,,,mbpdb_ace_000098 || MBPDB_P02754_CMENSA_122-127,10.1017/s0022029999003982,Angiotensin I-converting enzyme inhibitory properties of whey protein digests: concentration and characterization of active peptides || Bos taurus || Beta-lactoglobulin,out_of_length_range,mbpdb_core_standardized
,,,152,DKIHPF,6,True,True,256.8,256.8,256.8,256.8,=,exact_molar,sequence_level_core,True,True,1,1,,,,mbpdb_ace_000238 || MBPDB_P02666_DKIHPF_62-67,10.1128/AEM.66.9.3898-3904.2000,Production of Angiotensin-I-Converting-Enzyme-Inhibitory Peptides in Fermented Milks Started by Lactobacillus delbrueckii subsp bulgaricus SS1 and Lactococcus lactis subsp cremoris FT4 || Bos taurus || Beta-casein,out_of_length_range,mbpdb_core_standardized
,,,153,EKDERF,6,True,True,14.3,14.3,14.3,14.3,=,exact_molar,sequence_level_core,True,True,1,1,,,,mbpdb_ace_000058 || MBPDB_P02669_EKDERF_33-38,10.1002/elps.200700324,Identification of novel angiotensin-converting enzyme-inhibitory peptides from ovine milk proteins by CE-MS and chromatographic techniques || Ovis aries || Kappa-casein,out_of_length_range,mbpdb_core_standardized
,,,154,EMPFPK,6,True,True,565.58,565.58,565.58,565.58,=,exact_molar,sequence_level_core,True,True,1,1,,,,mbpdb_ace_000102 || MBPDB_P02666_EMPFPK_123-128,10.1016/S0958-6946(98)00048-X,Angiotensin I Converting Enzyme Inhibitory Peptides Derived from Bovine Milk Proteins || Bos taurus || Beta-casein,out_of_length_range,mbpdb_core_standardized
,,,155,ENLLRF,6,True,True,82.4,82.4,82.4,82.4,=,exact_molar,sequence_level_core,True,True,1,1,,,,mbpdb_ace_000325 || MBPDB_P18626_ENLLRF_33-38,10.3168/jds.S0022-0302(05)73032-0,Angiotensin-Converting Enzyme Inhibitory Activity of Peptides Derived from Caprine Kefir || Capra hircus || Alpha-S1-casein,out_of_length_range,mbpdb_core_standardized
,,,156,FALPQY,6,True,True,4.3,4.3,4.3,4.3,=,exact_molar,sequence_level_core,True,True,1,1,,,,mbpdb_ace_000282 || MBPDB_P02663_FALPQY_189-194,10.1016/s0014-5793(02)03576-7,Angiotensin-I-converting enzyme inhibitory peptides from tryptic hydrolysate of bovine αS2-casein || Bos taurus || Alpha-S2-casein,out_of_length_range,mbpdb_core_standardized
,,,157,FKCRRW,6,True,True,26.7,26.7,26.7,26.7,=,exact_molar,sequence_level_core,True,True,1,1,,,,mbpdb_ace_000026 || MBPDB_P24627_FKCRRW_36-41,10.1021/jf100899u,Antihypertensive Properties of Lactoferricin β-Derived Peptides || Bos taurus || Lactotransferrin,out_of_length_range,mbpdb_core_standardized
,,,158,GLDIQK,6,True,True,580.0,580.0,580.0,580.0,=,exact_molar,sequence_level_core,True,True,1,1,,,,mbpdb_ace_000069 || MBPDB_P02754_GLDIQK_25-30,10.1016/S0958-6946(98)00048-X,Angiotensin I Converting Enzyme Inhibitory Peptides Derived from Bovine Milk Proteins || Bos taurus || Beta-lactoglobulin,out_of_length_range,mbpdb_core_standardized
,,,159,HQIYPV,6,True,True,414.0,414.0,414.0,414.0,=,exact_molar,sequence_level_core,True,True,1,1,,,,mbpdb_ace_000116 || MBPDB_P05814_HQIYPV_208-213,10.1016/j.idairyj.2005.12.012,Identification of bioactive peptides after digestion of human milk and infant formula with pepsin and pancreatin || Homo sapiens || Beta-casein,out_of_length_range,mbpdb_core_standardized
,,,160,IPAVFK,6,True,True,144.8,144.8,144.8,144.8,=,exact_molar,sequence_level_core,True,True,1,1,,,,mbpdb_ace_000065 || MBPDB_P02754_IPAVFK_94-99,10.1016/j.jff.2014.04.002,Selective enrichment of bioactive properties during ultrafiltration of a tryptic digest of β-lactoglobulin || Bos taurus || Beta-lactoglobulin,out_of_length_range,mbpdb_core_standardized
,,,161,KFAWPQ,6,True,True,177.1,177.1,177.1,177.1,=,exact_molar,sequence_level_core,True,True,1,1,,,,mbpdb_ace_000276 || MBPDB_P33049_KFAWPQ_189-194,10.3168/jds.S0022-0302(05)73032-0,Angiotensin-Converting Enzyme Inhibitory Activity of Peptides Derived from Caprine Kefir || Capra hircus || Alpha-S2-casein,out_of_length_range,mbpdb_core_standardized
,,,162,KVLILA,6,True,True,20.85,20.85,20.85,20.85,=,exact_molar,sequence_level_core,True,True,1,1,,,,mbpdb_ace_000211 || MBPDB_P02666_KVLILA_7-Feb,10.1016/S1671-2927(11)60026-6,A Novel Angiotensin I Converting Enzyme Inhibitory Peptide from the Milk Casein: Virtual Screening and Docking Studies || Bos taurus || Beta-casein,out_of_length_range,mbpdb_core_standardized
,,,163,LAHKAL,6,True,True,621.0,621.0,621.0,621.0,=,exact_molar,sequence_level_core,True,True,1,1,,,,mbpdb_ace_000252 || MBPDB_P00711_LAHKAL_124-129,10.1016/S0958-6946(98)00048-X,Angiotensin I Converting Enzyme Inhibitory Peptides Derived from Bovine Milk Proteins || Bos taurus || Alpha-lactalbumin,out_of_length_range,mbpdb_core_standardized
,,,164,LAYFYP,6,True,True,65.0,65.0,65.0,65.0,=,exact_molar,sequence_level_core,True,True,1,1,,,,mbpdb_ace_000313 || MBPDB_P02662_LAYFYP_157-162,10.1016/S0958-6946(98)00048-X,Angiotensin I Converting Enzyme Inhibitory Peptides Derived from Bovine Milk Proteins || Bos taurus || Alpha-S1-casein,out_of_length_range,mbpdb_core_standardized
,,,165,LHLPLP,6,True,True,3.7,3.7,3.7,3.7,=,exact_molar,sequence_level_core,True,True,1,1,,,,mbpdb_ace_000203 || MBPDB_P05814_LHLPLP_139-144,"1) 10.1080/00021369.1989.10869621, 2) 10.1016/j.foodchem.2014.09.098, 3) 10.1016/j.idairyj.2005.12.011, 4) 10.1016/j.peptides.2009.06.031, 5) 10.3168/jds.S0022-0302(06)72372-4","1) Inhibition of Angiotensin-converting Enzyme by Synthetic Peptides of Human β-Casein, 2) Antihypertensive effect of the bovine casein-derived peptide Met-Lys-Pro, 3) Identification of novel antihypertensive peptides in milk fermented with Enterococcus faecalis, 4) Stability to gastrointestinal enzymes and structure-activity relationship of β-casein-peptides with antihypertensive properties, 5) Antihypertensive Effect of Peptides Obtained from Enterococcus faecalis-Fermented Milk in Rats || Homo sapiens || Beta-casein",out_of_length_range,mbpdb_core_standardized
,,,166,LRPVAA,6,True,True,4.14,4.14,4.14,4.14,=,exact_molar,sequence_level_core,True,True,1,1,,,,mbpdb_ace_000017 || MBPDB_P24627_LRPVAA_93-98,PMID: 16830788,The Antihypertensive Activity of Angiotensin-Converting Enzyme Inhibitory Peptide Containing in Bovine Lactoferrin || Bos taurus || Lactotransferrin,out_of_length_range,mbpdb_core_standardized
,,,167,LVYPFP,6,True,True,132.0,132.0,132.0,132.0,=,exact_molar,sequence_level_core,True,True,1,1,,,,mbpdb_ace_000191 || MBPDB_P02666_LVYPFP_73-78,10.1016/j.ijfoodmicro.2013.09.002,Novel probiotic-fermented milk with angiotensin I-converting enzyme inhibitory peptides produced by Bifidobacterium bifidum MF 20/5 || Bos taurus || Beta-casein,out_of_length_range,mbpdb_core_standardized
,,,168,PAVVLP,6,True,True,45.0,45.0,45.0,45.0,=,exact_molar,sequence_level_core,True,True,1,1,,,,mbpdb_ace_000174 || MBPDB_P05814_PAVVLP_87-92,10.1080/00021369.1989.10869621,Inhibition of Angiotensin-converting Enzyme by Synthetic Peptides of Human β-Casein || Homo sapiens || Beta-casein,out_of_length_range,mbpdb_core_standardized
,,,169,PLAQPA,6,True,True,940.0,940.0,940.0,940.0,=,exact_molar,sequence_level_core,True,True,1,1,,,,mbpdb_ace_000171 || MBPDB_P05814_PLAQPA_83-88,10.1016/j.idairyj.2005.12.012,Identification of bioactive peptides after digestion of human milk and infant formula with pepsin and pancreatin || Homo sapiens || Beta-casein,out_of_length_range,mbpdb_core_standardized
,,,170,PQNILP,6,True,True,440.0,440.0,440.0,440.0,=,exact_molar,sequence_level_core,True,True,1,1,,,,mbpdb_ace_000166 || MBPDB_P05814_PQNILP_78-83,10.1080/00021369.1989.10869621,Inhibition of Angiotensin-converting Enzyme by Synthetic Peptides of Human β-Casein || Homo sapiens || Beta-casein,out_of_length_range,mbpdb_core_standardized
,,,171,PYKLRP,6,True,True,10.2,10.2,10.2,10.2,=,exact_molar,sequence_level_core,True,True,1,1,,,,mbpdb_ace_000015 || MBPDB_P24627_PYKLRP_90-95,10.1021/jf4053868,Novel Antihypertensive Lactoferrin-Derived Peptides Produced by Kluyveromyces marxianus: Gastrointestinal Stability Profile and In Vivo Angiotensin I-Converting Enzyme (ACE) Inhibition || Bos taurus || Lactotransferrin,out_of_length_range,mbpdb_core_standardized
,,,172,PYVRYL,6,True,True,4.7,4.7,4.7,4.7,=,exact_molar,sequence_level_core,True,True,1,1,,,,mbpdb_ace_000263 || MBPDB_P02663_PYVRYL_217-222,"1) 10.3168/jds.S0022-0302(05)73032-0, 2) 10.3390/foods13213392","1) Angiotensin-Converting Enzyme Inhibitory Activity of Peptides Derived from Caprine Kefir, 2) Goat Milk Protein-Derived ACE Inhibitory Peptide SLPQ Exerts Hypertension Alleviation Effects Partially by Regulating the Inflammatory Stress of Endothelial Cells || Bos taurus || Alpha-S2-casein",out_of_length_range,mbpdb_core_standardized
,,,173,QPLIYP,6,True,True,3.6,3.6,3.6,3.6,=,exact_molar,sequence_level_core,True,True,1,1,,,,mbpdb_ace_000157 || MBPDB_P05814_QPLIYP_62-67,10.1080/00021369.1989.10869621,Inhibition of Angiotensin-converting Enzyme by Synthetic Peptides of Human β-Casein || Homo sapiens || Beta-casein,out_of_length_range,mbpdb_core_standardized
,,,174,QSLVYP,6,True,True,41.0,41.0,41.0,41.0,=,exact_molar,sequence_level_core,True,True,1,1,,,,mbpdb_ace_000155 || MBPDB_P02666_QSLVYP_71-76,10.1271/bbb1961.54.1101,Inhibition of angiotensin-converting enzyme by synthetic peptide fragments of various β-caseins || Bos taurus || Beta-casein,out_of_length_range,mbpdb_core_standardized
,,,175,RPKHPI,6,True,True,40.3,40.3,40.3,40.3,=,exact_molar,sequence_level_core,True,True,1,1,,,,mbpdb_ace_000307 || MBPDB_P04653_RPKHPI_16-21,10.1128/AEM.69.9.5297-5305.2003,Angiotensin I-Converting-Enzyme-Inhibitory and Antibacterial Peptides from Lactobacillus helveticusPR4 Proteinase-Hydrolyzed Caseins of Milk from Six Species || Ovis aries || Alpha-S1-casein,out_of_length_range,mbpdb_core_standardized
,,,176,RRWQWR,6,True,True,32.0,32.0,32.0,32.0,=,exact_molar,sequence_level_core,True,True,1,1,,,,mbpdb_ace_000013 || MBPDB_P24627_RRWQWR_39-44,10.1021/jf100899u,Antihypertensive Properties of Lactoferricin B-Derived Peptides || Bos taurus || Lactotransferrin,out_of_length_range,mbpdb_core_standardized
,,,177,RYPSYG,6,True,True,65.71,65.71,65.71,65.71,=,exact_molar,sequence_level_core,True,True,1,1,,,,mbpdb_ace_000048 || MBPDB_P02668_RYPSYG_55-60,10.1016/j.foodchem.2010.05.026,"Production, analysis and in vivo evaluation of novel angiotensin-I-converting enzyme inhibitory peptides from bovine casein || Bos taurus || Kappa-casein",out_of_length_range,mbpdb_core_standardized
,,,178,TGPIPN,6,True,True,316.0,316.0,316.0,316.0,=,exact_molar,sequence_level_core,True,True,1,1,,,,mbpdb_ace_000143 || MBPDB_P33048_TGPIPN_78-83,10.3168/jds.S0022-0302(06)72369-4,Identification and Characterization of Novel Angiotensin-Converting Enzyme Inhibitors Obtained from Goat Milk || Capra hircus || Beta-casein,out_of_length_range,mbpdb_core_standardized
,,,179,TTMPLW,6,True,True,16.0,16.0,16.0,16.0,=,exact_molar,sequence_level_core,True,True,1,1,,,,mbpdb_ace_000298 || MBPDB_P02662_TTMPLW_209-214,"1) 10.1016/S0958-6946(98)00048-X, 2) 10.1016/s0014-5793(02)03576-7, 3) 10.1080/00021369.1987.10868415","1) Angiotensin I Converting Enzyme Inhibitory Peptides Derived from Bovine Milk Proteins, 2) Angiotensin-I-converting enzyme inhibitory peptides from tryptic hydrolysate of bovine αS2-casein, 3) Angiotensin I-Converting Enzyme Inhibitory Activity of the C-Terminal Hexapeptide of αs1- Casein || Bos taurus || Alpha-S1-casein",out_of_length_range,mbpdb_core_standardized
,,,180,TVDQHQ,6,True,True,210.5,210.5,210.5,210.5,=,exact_molar,sequence_level_core,True,True,1,1,,,,mbpdb_ace_000270 || MBPDB_P33049_TVDQHQ_198-203,10.1128/AEM.69.9.5297-5305.2003,Angiotensin I-Converting-Enzyme-Inhibitory and Antibacterial Peptides from Lactobacillus helveticusPR4 Proteinase-Hydrolyzed Caseins of Milk from Six Species || Capra hircus || Alpha-S2-casein,out_of_length_range,mbpdb_core_standardized
,,,181,VAGTWY,6,True,True,767.5,767.5,767.5,767.5,=,exact_molar,sequence_level_core,True,True,1,1,,,,mbpdb_ace_000064 || MBPDB_P02754_VAGTWY_31-36,10.1017/s0022029999003982,Angiotensin I-converting enzyme inhibitory properties of whey protein digests: concentration and characterization of active peptides || Bos taurus || Beta-lactoglobulin,out_of_length_range,mbpdb_core_standardized
,,,182,VLDTDY,6,True,True,128.0,128.0,128.0,128.0,=,exact_molar,sequence_level_core,True,True,1,1,,,,mbpdb_ace_000071 || MBPDB_P02754_VLDTDY_110-115,10.1016/j.jff.2015.11.038,Do whey protein-derived peptides have dual dipeptidyl-peptidase IV and angiotensin I-converting enzyme inhibitory activities? || Bos taurus || Beta-lactoglobulin,out_of_length_range,mbpdb_core_standardized
,,,183,VLSRYP,6,True,True,36.7,36.7,36.7,36.7,=,exact_molar,sequence_level_core,True,True,1,1,,,,mbpdb_ace_000045 || MBPDB_P02668_VLSRYP_52-57,10.1016/j.jff.2015.04.043,Purification and identification of novel peptides with inhibitory effect against angiotensin I-converting enzyme and optimization of process conditions in milk fermented with the yeast Kluyveromyces marxianus || Bos taurus || Kappa-casein,out_of_length_range,mbpdb_core_standardized
,,,184,VPQPIP,6,True,True,290.0,290.0,290.0,290.0,=,exact_molar,sequence_level_core,True,True,1,1,,,,mbpdb_ace_000132 || MBPDB_P05814_VPQPIP_153-158,10.1080/00021369.1989.10869621,Inhibition of Angiotensin-converting Enzyme by Synthetic Peptides of Human β-Casein || Homo sapiens || Beta-casein,out_of_length_range,mbpdb_core_standardized
,,,185,VPSERY,6,True,True,706.1,706.1,706.1,706.1,=,exact_molar,sequence_level_core,True,True,1,1,,,,mbpdb_ace_000304 || MBPDB_P04653_VPSERY_101-106,10.1016/j.idairyj.2004.04.007,Angiotensin converting enzyme-inhibitory activity of peptides isolated from Manchego cheese Stability under simulated gastrointestinal digestion || Ovis aries || Alpha-S1-casein,out_of_length_range,mbpdb_core_standardized
,,,186,VRGPFP,6,True,True,592.0,592.0,592.0,592.0,=,exact_molar,sequence_level_core,True,True,1,1,,,,mbpdb_ace_000130 || MBPDB_P11839_VRGPFP_214-219,10.1016/S0958-6946(02)00059-6,Angiotensin-converting enzyme-inhibitory peptides in Manchego cheeses manufactured with different starter cultures || Ovis aries || Beta-casein,out_of_length_range,mbpdb_core_standardized
,,,187,VSLPEW,6,True,True,57.0,57.0,57.0,57.0,=,exact_molar,sequence_level_core,True,True,1,1,,,,mbpdb_ace_000250 || MBPDB_P00711_VSLPEW_40-45,10.1016/j.idairyj.2007.04.008,Fractionation and identification of ACE-inhibitory peptides from α-Lactalbumin and β-casein produced by thermolysin-catalysed hydrolysis || Bos taurus || Alpha-lactalbumin,out_of_length_range,mbpdb_core_standardized
,,,188,VYPFPG,6,True,True,221.0,221.0,221.0,221.0,=,exact_molar,sequence_level_core,True,True,1,1,,,,mbpdb_ace_000125 || MBPDB_P02666_VYPFPG_74-79,10.3168/jds.S0022-0302(98)75878-3,Structural analysis of new antihypertensive peptides derived from cheese whey protein by proteinase K digestion || Bos taurus || Beta-casein,out_of_length_range,mbpdb_core_standardized
,,,189,WYSLAM,6,True,True,56.3,56.3,56.3,56.3,=,exact_molar,sequence_level_core,True,True,1,1,,,,mbpdb_ace_000079 || MBPDB_P02754_WYSLAM_35-40,10.1021/jf063427j,ACE-Inhibitory and Radical-Scavenging Activity of Peptides Derived from β-Lactoglobulin f(19-25) Interactions with Ascorbic Acid || Bos taurus || Beta-lactoglobulin,out_of_length_range,mbpdb_core_standardized
,,,190,YAKPVA,6,True,True,14.3,14.3,14.3,14.3,=,exact_molar,sequence_level_core,True,True,1,1,,,,mbpdb_ace_000042 || MBPDB_P02669_YAKPVA_82-87,10.1002/mnfr.200900448,Changes in arterial blood pressure after single oral administration of milk-casein-derived peptides in spontaneously hypertensive rats || Ovis aries || Kappa-casein,out_of_length_range,mbpdb_core_standardized
,,,191,YFYPEL,6,True,True,8.82,8.82,8.82,8.82,=,exact_molar,sequence_level_core,True,True,1,1,,,,mbpdb_ace_000288 || MBPDB_P02662_YFYPEL_159-164,10.3390/foods9080991,In Silico and In Vitro Analysis of Multifunctionality of Animal Food-Derived Peptides || Bos taurus || Alpha-S1-casein,out_of_length_range,mbpdb_core_standardized
,,,192,YIPIQY,6,True,True,10.0,10.0,10.0,10.0,=,exact_molar,sequence_level_core,True,True,1,1,,,,mbpdb_ace_000040 || MBPDB_P02669_YIPIQY_46-51,10.1002/elps.200700324,Identification of novel angiotensin-converting enzyme-inhibitory peptides from ovine milk proteins by CE-MS and chromatographic techniques || Ovis aries || Kappa-casein,out_of_length_range,mbpdb_core_standardized
,,,193,YKVPQL,6,True,True,22.0,22.0,22.0,22.0,=,exact_molar,sequence_level_core,True,True,1,1,,,,mbpdb_ace_000302 || MBPDB_P02662_YKVPQL_119-124,10.3168/jds.S0022-0302(96)76487-1,Identification of an Antihypertensive Peptide from Casein Hydrolysate Produced by a Proteinase from Lactobacillus helveticus CP790 || Bos taurus || Alpha-S1-casein,out_of_length_range,mbpdb_core_standardized
,,,194,YLGYLE,6,True,True,85.76,85.76,85.76,85.76,=,exact_molar,sequence_level_core,True,True,1,1,,,,mbpdb_ace_000287 || MBPDB_P02662_YLGYLE_106-111,10.3390/foods9080991,In Silico and In Vitro Analysis of Multifunctionality of Animal Food-Derived Peptides || Bos taurus || Alpha-S1-casein,out_of_length_range,mbpdb_core_standardized
,,,195,YPFVEP,6,True,True,7.48,7.48,7.48,7.48,=,exact_molar,sequence_level_core,True,True,1,1,,,,mbpdb_ace_000344 || MBPDB_P05814_YPFVEP_66-71,10.3390/foods9080991,In Silico and In Vitro Analysis of Multifunctionality of Animal Food-Derived Peptides || Homo sapiens || Beta-casein,out_of_length_range,mbpdb_core_standardized
,,,196,YQEPVL,6,True,True,144.07,144.07,144.07,144.07,=,exact_molar,sequence_level_core,True,True,1,1,,,,mbpdb_ace_000121 || MBPDB_P02666_YQEPVL_208-213,"1) 10.1016/S0958-6946(98)00048-X, 2) 10.1016/j.idairyj.2007.02.009","1) Angiotensin I Converting Enzyme Inhibitory Peptides Derived from Bovine Milk Proteins, 2) ACE-inhibitory activity of probiotic yoghurt || Bos taurus || Beta-casein",out_of_length_range,mbpdb_core_standardized
,,,197,ALPMHIR,7,True,True,28.3,28.3,28.3,28.3,=,exact_molar,sequence_level_core,True,True,1,1,,,,mbpdb_ace_000066 || MBPDB_P02754_ALPMHIR_158-164,"1) 10.1016/j.foodchem.2014.09.098, 2) 10.1016/s0014-5793(96)01503-7","1) Antihypertensive effect of the bovine casein-derived peptide Met-Lys-Pro, 2) Identification of a novel angiotensin-I-converting enzyme inhibitory peptide corresponding to a tryptic fragment of bovine β-lactoglobulin || Bos taurus || Beta-lactoglobulin",out_of_length_range,mbpdb_core_standardized
,,,198,AVPYPQR,7,True,True,144.5,144.5,144.5,144.5,=,exact_molar,sequence_level_core,True,True,1,1,,,,mbpdb_ace_000117 || MBPDB_P02666_AVPYPQR_192-198,"1) 10.1080/00021369.1985.10866901, 2) 10.1016/S0958-6946(98)00048-X","1) Angiotensin I-Converting Enzyme Inhibitor Derived from an Enzymatic Hydrolysate of Casein II Isolation and Bradykinin-potentiating Activity on the Uterus and the Ileum of Rats, 2) Angiotensin I Converting Enzyme Inhibitory Peptides Derived from Bovine Milk Proteins || Bos taurus || Beta-casein",out_of_length_range,mbpdb_core_standardized
,,,199,AYFYPEL,7,True,True,6.58,6.58,6.58,6.58,=,exact_molar,sequence_level_core,True,True,1,1,,,,mbpdb_ace_000290 || MBPDB_P02662_AYFYPEL_158-164,10.1016/j.idairyj.2009.05.004,Novel casein-derived peptides with antihypertensive activity || Bos taurus || Alpha-S1-casein,out_of_length_range,mbpdb_core_standardized
,,,200,CRRWQWR,7,True,True,2.3,2.3,2.3,2.3,=,exact_molar,sequence_level_core,True,True,1,1,,,,mbpdb_ace_000028 || MBPDB_P24627_CRRWQWR_38-44,10.1021/jf100899u,Antihypertensive Properties of Lactoferricin β-Derived Peptides || Bos taurus || Lactotransferrin,out_of_length_range,mbpdb_core_standardized
,,,201,DKVGINY,7,True,True,102.06,102.06,102.06,102.06,=,exact_molar,sequence_level_core,True,True,1,1,,,,mbpdb_ace_000259 || MBPDB_P00711_DKVGINY_116-122,"1) 10.1016/j.peptides.2011.02.005, 2) 10.1016/j.foodchem.2011.09.052","1) Novel whey-derived peptides with inhibitory effect against angiotensin-converting enzyme: In vitro effect and stability to gastrointestinal enzymes, 2) The Portuguese Paradox: Why do some inhabitants of Portugal appear to live so long when their diet is based on whey cheese? || Bos taurus || Alpha-lactalbumin",out_of_length_range,mbpdb_core_standardized
,,,202,DPYKLRP,7,True,True,30.5,30.5,30.5,30.5,=,exact_molar,sequence_level_core,True,True,1,1,,,,mbpdb_ace_000027 || MBPDB_P24627_DPYKLRP_89-95,10.1021/jf4053868,Novel Antihypertensive Lactoferrin-Derived Peptides Produced by Kluyveromyces marxianus: Gastrointestinal Stability Profile and In Vivo Angiotensin I-Converting Enzyme (ACE) Inhibition || Bos taurus || Lactotransferrin,out_of_length_range,mbpdb_core_standardized
,,,203,FPEVFGK,7,True,True,140.0,140.0,140.0,140.0,=,exact_molar,sequence_level_core,True,True,1,1,,,,mbpdb_ace_000321 || MBPDB_P02662_FPEVFGK_43-49,10.1080/00021369.1987.10868244,Studies on the Active Site and Antihypertensive Activity of Angiotensin I-Converting Enzyme Inhibitors Derived from Casein || Bos taurus || Alpha-S1-casein,out_of_length_range,mbpdb_core_standardized
,,,204,FPQYLQY,7,True,True,14.0,14.0,14.0,14.0,=,exact_molar,sequence_level_core,True,True,1,1,,,,mbpdb_ace_000281 || MBPDB_P02663_FPQYLQY_107-113,10.1016/s0014-5793(02)03576-7,Angiotensin-I-converting enzyme inhibitory peptides from tryptic hydrolysate of bovine αS2-casein || Bos taurus || Alpha-S2-casein,out_of_length_range,mbpdb_core_standardized
,,,205,FSDKIAK,7,True,True,113.6,113.6,113.6,113.6,=,exact_molar,sequence_level_core,True,True,1,1,,,,mbpdb_ace_000038 || MBPDB_P02668_FSDKIAK_39-45,10.1051/lait:2007019,"Casein hydrolysates as a source of antimicrobial, antioxidant and antihypertensive peptides || Bos taurus || Kappa-casein",out_of_length_range,mbpdb_core_standardized
,,,206,GPFPILV,7,True,True,424.0,424.0,424.0,424.0,=,exact_molar,sequence_level_core,True,True,1,1,,,,mbpdb_ace_000108 || MBPDB_P33048_GPFPILV_216-222,10.3168/jds.S0022-0302(05)73032-0,Angiotensin-Converting Enzyme Inhibitory Activity of Peptides Derived from Caprine Kefir || Capra hircus || Beta-casein,out_of_length_range,mbpdb_core_standardized
,,,207,GVSLPEW,7,True,True,30.0,30.0,30.0,30.0,=,exact_molar,sequence_level_core,True,True,1,1,,,,mbpdb_ace_000257 || MBPDB_P00711_GVSLPEW_39-45,10.1016/j.idairyj.2007.04.008,Fractionation and identification of ACE-inhibitory peptides from α-Lactalbumin and β-casein produced by thermolysin-catalysed hydrolysis || Bos taurus || Alpha-lactalbumin,out_of_length_range,mbpdb_core_standardized
,,,208,KKYNVPQ,7,True,True,716.9,716.9,716.9,716.9,=,exact_molar,sequence_level_core,True,True,1,1,,,,mbpdb_ace_000315 || MBPDB_P04653_KKYNVPQ_117-123,10.1016/j.idairyj.2004.04.007,Angiotensin converting enzyme-inhibitory activity of peptides isolated from Manchego cheese Stability under simulated gastrointestinal digestion || Ovis aries || Alpha-S1-casein,out_of_length_range,mbpdb_core_standardized
,,,209,KLLSHSL,7,True,True,42.51,42.51,42.51,42.51,=,exact_molar,sequence_level_core,True,True,1,1,,,,mbpdb_ace_000327 || MBPDB_P01966_KLLSHSL_100-106,10.1007/s00217-011-1430-z,a 67-106 of bovine hemoglobin: a new family of antimicrobial and angiotensin I-converting enzyme inhibitory peptides || Bos taurus || Hemoglobin subunit alpha,out_of_length_range,mbpdb_core_standardized
,,,210,KVLPVPQ,7,True,True,1000.0,1000.0,1000.0,1000.0,=,exact_molar,sequence_level_core,True,True,1,1,,,,mbpdb_ace_000209 || MBPDB_P02666_KVLPVPQ_184-190,"1) 10.3168/jds.S0022-0302(96)76487-1, 2) 10.3168/jds.2019-17976, 3) 10.1016/j.peptides.2008.02.005","1) Identification of an Antihypertensive Peptide from Casein Hydrolysate Produced by a Proteinase from Lactobacillus helveticus CP790, 2) Characterization of casein-derived peptide bioactivity: Differential effects on angiotensin-converting enzyme inhibition and cytokine and nitric oxide production, 3) The antihypertensive effect of peptides: a novel alternative to drugs? || Bos taurus || Beta-casein",out_of_length_range,mbpdb_core_standardized
,,,211,LHLPLPL,7,True,True,425.0,425.0,425.0,425.0,=,exact_molar,sequence_level_core,True,True,1,1,,,,mbpdb_ace_000202 || MBPDB_P02666_LHLPLPL_148-154,10.1016/j.idairyj.2005.12.011,Identification of novel antihypertensive peptides in milk fermented with Enterococcus faecalis || Bos taurus || Beta-casein,out_of_length_range,mbpdb_core_standardized
,,,212,LKALPMH,7,True,True,11.0,11.0,11.0,11.0,=,exact_molar,sequence_level_core,True,True,1,1,,,,mbpdb_ace_000072 || MBPDB_P02754_LKALPMH_156-162,10.1016/j.jff.2015.11.038,Do whey protein-derived peptides have dual dipeptidyl-peptidase IV and angiotensin I-converting enzyme inhibitory activities? || Bos taurus || Beta-lactoglobulin,out_of_length_range,mbpdb_core_standardized
,,,213,LNNSRAP,7,True,True,105.3,105.3,105.3,105.3,=,exact_molar,sequence_level_core,True,True,1,1,,,,mbpdb_ace_000019 || MBPDB_P24627_LNNSRAP_251-257,10.1016/j.foodchem.2011.08.076,Antihypertensive effect of a bovine lactoferrin pepsin hydrolysate: Identification of novel active peptides || Bos taurus || Lactotransferrin,out_of_length_range,mbpdb_core_standardized
